{"$schema":"https://json-schema.org/draft/2020-12/schema","$id":"https://agile-v.org/schemas/EVIDENCE_BUNDLE.v2.schema.json","title":"Evidence bundle v2 (typed claims and evidence admission)","type":"object","required":["schema_version","compatibility","migration","fixture_owner","bundle"],"properties":{"schema_version":{"const":"2.2"},"compatibility":{"type":"string","minLength":1},"migration":{"type":"string","minLength":1},"fixture_owner":{"type":"string","minLength":1},"bundle":{"type":"object","required":["id","task_id","risk_level","baseline","policy_binding","claims","evidence","admission"],"properties":{"id":{"pattern":"^EVD-[A-Z0-9-]+$"},"task_id":{"type":"string","minLength":1},"risk_level":{"enum":["L0","L1","L2","L3","L4"]},"baseline":{"type":"object","required":["requirement_baseline_id","requirement_digest","subject_state"],"properties":{"requirement_baseline_id":{"type":"string","minLength":1},"requirement_digest":{"pattern":"^sha256:[a-f0-9]{64}$"},"subject_state":{"type":"object","required":["subject_type","subject_ref","subject_digest"],"properties":{"subject_type":{"enum":["source_control_commit","document_revision","hardware_revision","dataset_version","configuration_baseline","other"]},"subject_ref":{"type":"string","minLength":1},"subject_digest":{"pattern":"^sha256:[a-f0-9]{64}$"},"profile_specific":{"type":"object","additionalProperties":true}},"additionalProperties":true}},"additionalProperties":true},"policy_binding":{"type":"object","required":["policy_id","policy_version","policy_digest"],"properties":{"policy_id":{"type":"string","minLength":1},"policy_version":{"type":"string","minLength":1},"policy_digest":{"pattern":"^sha256:[a-f0-9]{64}$"},"control_matrix_digest":{"pattern":"^sha256:[a-f0-9]{64}$"}},"additionalProperties":true},"environment_binding":{"type":"object","properties":{"environment_id":{"type":"string"},"environment_digest":{"pattern":"^sha256:[a-f0-9]{64}$"},"hardware_revision":{"type":["string","null"]}},"additionalProperties":true},"claims":{"type":"array","minItems":1,"items":{"type":"object","required":["claim_id","claim_type","subject_ref","predicate","object_ref","required_evidence_properties"],"properties":{"claim_id":{"pattern":"^CLM-[A-Z0-9-]+$"},"claim_type":{"type":"string","minLength":1},"subject_ref":{"type":"string","minLength":1},"predicate":{"type":"string","minLength":1},"object_ref":{"type":"string","minLength":1},"required_evidence_properties":{"type":"array","minItems":1,"items":{"type":"string"}}},"additionalProperties":true}},"evidence":{"type":"array","items":{"type":"object","required":["evidence_id","evidence_type","supports","producer","result","state_binding","integrity"],"properties":{"evidence_id":{"pattern":"^EVI-[A-Z0-9-]+$"},"evidence_type":{"type":"string","minLength":1},"supports":{"type":"array","minItems":1,"items":{"pattern":"^CLM-[A-Z0-9-]+$"}},"producer":{"type":"object","required":["identity","role"],"properties":{"identity":{"type":"string","minLength":1},"role":{"type":"string","minLength":1},"runtime_ref":{"type":"string"},"authority_ref":{"type":"string"}},"additionalProperties":true},"result":{"type":"object","required":["status"],"properties":{"status":{"enum":["pass","fail","error","not_applicable"]}},"additionalProperties":true},"state_binding":{"type":"object","required":["subject_ref"],"properties":{"subject_ref":{"type":"string","minLength":1},"subject_digest":{"pattern":"^sha256:[a-f0-9]{64}$"},"profile_specific":{"type":"object","additionalProperties":true}},"additionalProperties":true},"policy_binding":{"type":"object","properties":{"policy_digest":{"pattern":"^sha256:[a-f0-9]{64}$"}},"additionalProperties":true},"invalidation_dependencies":{"type":"array","items":{"type":"object","required":["kind","ref"],"properties":{"kind":{"enum":["source","requirement","policy","environment","tool","model","hardware"]},"ref":{"type":"string","minLength":1}},"additionalProperties":true}},"integrity":{"type":"object","required":["digest"],"properties":{"digest":{"pattern":"^sha256:[a-f0-9]{64}$"}},"additionalProperties":true}},"additionalProperties":true}},"obligations":{"type":"array","items":{"type":"object","required":["obligation_id","state"],"properties":{"obligation_id":{"pattern":"^OBL-[A-Z0-9-]+$"},"state":{"enum":["pending","discharged","violated","waived","escalated"]},"evidence_ref":{"pattern":"^EVI-[A-Z0-9-]+$"}},"additionalProperties":true}},"residual_risks":{"type":"array","items":{"type":"object","required":["risk_ref"],"properties":{"risk_ref":{"type":"string","minLength":1}},"additionalProperties":true}},"admission":{"type":"object","required":["status"],"properties":{"status":{"enum":["pending","admitted","rejected","waived"]},"rationale_ref":{"type":"string"}},"additionalProperties":true}},"additionalProperties":true,"allOf":[{"if":{"properties":{"risk_level":{"enum":["L2","L3","L4"]}},"required":["risk_level"]},"then":{"properties":{"evidence":{"items":{"required":["evidence_id","evidence_type","supports","producer","result","state_binding","policy_binding","integrity"]}}}}}]}},"additionalProperties":false}
