{
  "schema_version": "2.2",
  "compatibility": "additive",
  "migration": "none",
  "fixture_owner": "tests",
  "bundle": {
    "id": "EVD-AAV-0042",
    "task_id": "AAV-0042",
    "risk_level": "L2",
    "baseline": {
      "requirement_baseline_id": "BL-1",
      "requirement_digest": "sha256:aaaaaaaaaaaaaaaaaaaaaaaaaaaaaaaaaaaaaaaaaaaaaaaaaaaaaaaaaaaaaaaa",
      "subject_state": {
        "subject_type": "source_control_commit",
        "subject_ref": "cccccccccccccccccccccccccccccccccccccccc",
        "subject_digest": "sha256:dddddddddddddddddddddddddddddddddddddddddddddddddddddddddddddddd",
        "profile_specific": {
          "repository_commit": "cccccccccccccccccccccccccccccccccccccccc",
          "build_digest": "sha256:dddddddddddddddddddddddddddddddddddddddddddddddddddddddddddddddd",
          "tree_digest": "sha256:bbbbbbbbbbbbbbbbbbbbbbbbbbbbbbbbbbbbbbbbbbbbbbbbbbbbbbbbbbbbbbbb"
        }
      }
    },
    "policy_binding": {
      "policy_id": "POL-1",
      "policy_version": "2.3",
      "policy_digest": "sha256:eeeeeeeeeeeeeeeeeeeeeeeeeeeeeeeeeeeeeeeeeeeeeeeeeeeeeeeeeeeeeeee",
      "control_matrix_digest": "sha256:ffffffffffffffffffffffffffffffffffffffffffffffffffffffffffffffff"
    },
    "environment_binding": {
      "environment_id": "ENV-1",
      "environment_digest": "sha256:1111111111111111111111111111111111111111111111111111111111111111",
      "hardware_revision": null
    },
    "claims": [
      {
        "claim_id": "CLM-1",
        "claim_type": "requirement_satisfaction",
        "subject_ref": "ART-1",
        "predicate": "satisfies",
        "object_ref": "REQ-1",
        "required_evidence_properties": [
          "provenance",
          "state_binding",
          "test_result"
        ]
      }
    ],
    "evidence": [
      {
        "evidence_id": "EVI-1",
        "evidence_type": "test_result",
        "supports": [
          "CLM-1"
        ],
        "producer": {
          "identity": "ci-runner-primary",
          "role": "ci",
          "runtime_ref": "gha-1"
        },
        "result": {
          "status": "pass"
        },
        "state_binding": {
          "subject_ref": "cccccccccccccccccccccccccccccccccccccccc",
          "subject_digest": "sha256:dddddddddddddddddddddddddddddddddddddddddddddddddddddddddddddddd",
          "profile_specific": {
            "source_commit": "cccccccccccccccccccccccccccccccccccccccc",
            "build_digest": "sha256:dddddddddddddddddddddddddddddddddddddddddddddddddddddddddddddddd"
          }
        },
        "policy_binding": {
          "policy_digest": "sha256:eeeeeeeeeeeeeeeeeeeeeeeeeeeeeeeeeeeeeeeeeeeeeeeeeeeeeeeeeeeeeeee"
        },
        "invalidation_dependencies": [
          {
            "kind": "source",
            "ref": "source_commit"
          },
          {
            "kind": "policy",
            "ref": "policy_digest"
          }
        ],
        "integrity": {
          "digest": "sha256:2222222222222222222222222222222222222222222222222222222222222222"
        }
      }
    ],
    "obligations": [
      {
        "obligation_id": "OBL-1",
        "state": "discharged",
        "evidence_ref": "EVI-1"
      }
    ],
    "residual_risks": [],
    "admission": {
      "status": "admitted",
      "rationale_ref": "GATE-1"
    }
  }
}
